{
  "artifactVersion": "1.0.0",
  "commandDigestVersion": "1.0.0",
  "packageName": "kokoro.platform.v1",
  "commands": [
    {
      "operation": "skill.create_draft",
      "fqMethod": "kokoro.platform.v1.SkillCatalogService/CreateSkillDraft",
      "commandField": {
        "field": "command",
        "tag": 2,
        "type": "kokoro.common.v1.CommandIdentity"
      },
      "rootMembers": [
        "command_digest_version",
        "fq_method",
        "tenant_ref",
        "command"
      ],
      "commandMembers": [
        "owner_scope",
        "metadata{display_name,summary,tags:array<string>,metadata_json:base64url-no-pad}"
      ],
      "excludedMembers": ["request_id", "command", "execution_proof"]
    },
    {
      "operation": "skill.create_version",
      "fqMethod": "kokoro.platform.v1.SkillCatalogService/CreateSkillVersion",
      "commandField": {
        "field": "command",
        "tag": 2,
        "type": "kokoro.common.v1.CommandIdentity"
      },
      "rootMembers": [
        "command_digest_version",
        "fq_method",
        "tenant_ref",
        "command"
      ],
      "commandMembers": [
        "owner_scope",
        "base_skill_id:id<SkillId>",
        "metadata{display_name,summary,tags:array<string>,metadata_json:base64url-no-pad}"
      ],
      "excludedMembers": ["request_id", "command", "execution_proof"]
    },
    {
      "operation": "skill.validate_draft",
      "fqMethod": "kokoro.platform.v1.SkillCatalogService/ValidateSkillDraft",
      "commandField": {
        "field": "command",
        "tag": 2,
        "type": "kokoro.common.v1.CommandIdentity"
      },
      "rootMembers": [
        "command_digest_version",
        "fq_method",
        "tenant_ref",
        "command"
      ],
      "commandMembers": [
        "skill_id:id<SkillId>",
        "package_asset_ref:string",
        "content_digest:lowercase-64hex"
      ],
      "excludedMembers": ["request_id", "command", "execution_proof"]
    },
    {
      "operation": "skill.publish",
      "fqMethod": "kokoro.platform.v1.SkillCatalogService/PublishSkill",
      "commandField": {
        "field": "command",
        "tag": 2,
        "type": "kokoro.common.v1.CommandIdentity"
      },
      "rootMembers": [
        "command_digest_version",
        "fq_method",
        "tenant_ref",
        "command"
      ],
      "commandMembers": ["skill_id:id<SkillId>", "visibility:enum"],
      "excludedMembers": ["request_id", "command", "execution_proof"]
    },
    {
      "operation": "skill.withdraw",
      "fqMethod": "kokoro.platform.v1.SkillCatalogService/WithdrawSkill",
      "commandField": {
        "field": "command",
        "tag": 2,
        "type": "kokoro.common.v1.CommandIdentity"
      },
      "rootMembers": [
        "command_digest_version",
        "fq_method",
        "tenant_ref",
        "command"
      ],
      "commandMembers": ["source_ref:id<SkillSourceRef>", "reason:string"],
      "excludedMembers": ["request_id", "command", "execution_proof"]
    },
    {
      "operation": "skill.set_status",
      "fqMethod": "kokoro.platform.v1.SkillCatalogService/SetSkillStatus",
      "commandField": {
        "field": "command",
        "tag": 2,
        "type": "kokoro.common.v1.CommandIdentity"
      },
      "rootMembers": [
        "command_digest_version",
        "fq_method",
        "tenant_ref",
        "command"
      ],
      "commandMembers": ["skill_id:id<SkillId>", "status:enum"],
      "excludedMembers": ["request_id", "command", "execution_proof"]
    },
    {
      "operation": "skill.install",
      "fqMethod": "kokoro.platform.v1.SkillInstallationService/InstallSkill",
      "commandField": {
        "field": "command",
        "tag": 2,
        "type": "kokoro.common.v1.CommandIdentity"
      },
      "rootMembers": [
        "command_digest_version",
        "fq_method",
        "tenant_ref",
        "command"
      ],
      "commandMembers": [
        "source_ref:id<SkillSourceRef>",
        "target_owner_scope:msg<OwnerScope>"
      ],
      "excludedMembers": ["request_id", "command", "execution_proof"]
    },
    {
      "operation": "skill.set_installation_enabled",
      "fqMethod": "kokoro.platform.v1.SkillInstallationService/SetSkillInstallationEnabled",
      "commandField": {
        "field": "command",
        "tag": 2,
        "type": "kokoro.common.v1.CommandIdentity"
      },
      "rootMembers": [
        "command_digest_version",
        "fq_method",
        "tenant_ref",
        "command"
      ],
      "commandMembers": [
        "installation_id:id<SkillInstallationId>",
        "enabled:boolean"
      ],
      "excludedMembers": ["request_id", "command", "execution_proof"]
    },
    {
      "operation": "skill.remove_installation",
      "fqMethod": "kokoro.platform.v1.SkillInstallationService/RemoveSkillInstallation",
      "commandField": {
        "field": "command",
        "tag": 2,
        "type": "kokoro.common.v1.CommandIdentity"
      },
      "rootMembers": [
        "command_digest_version",
        "fq_method",
        "tenant_ref",
        "command"
      ],
      "commandMembers": ["installation_id:id<SkillInstallationId>"],
      "excludedMembers": ["request_id", "command", "execution_proof"]
    },
    {
      "operation": "mcp.create_connector",
      "fqMethod": "kokoro.platform.v1.McpConnectorService/CreateMcpConnector",
      "commandField": {
        "field": "command",
        "tag": 2,
        "type": "kokoro.common.v1.CommandIdentity"
      },
      "rootMembers": [
        "command_digest_version",
        "fq_method",
        "tenant_ref",
        "command"
      ],
      "commandMembers": [
        "owner_scope:msg<OwnerScope>",
        "connector_type:enum",
        "provider_key:string",
        "requested_scopes:set<string>"
      ],
      "excludedMembers": ["request_id", "command", "execution_proof"]
    },
    {
      "operation": "mcp.begin_connector_authorization",
      "fqMethod": "kokoro.platform.v1.McpConnectorService/BeginMcpConnectorAuthorization",
      "commandField": {
        "field": "command",
        "tag": 2,
        "type": "kokoro.common.v1.CommandIdentity"
      },
      "rootMembers": [
        "command_digest_version",
        "fq_method",
        "tenant_ref",
        "command"
      ],
      "commandMembers": ["connector_id:id<McpConnectorId>"],
      "excludedMembers": ["request_id", "command", "execution_proof"]
    },
    {
      "operation": "mcp.complete_connector_authorization",
      "fqMethod": "kokoro.platform.v1.McpConnectorService/CompleteMcpConnectorAuthorization",
      "commandField": {
        "field": "command",
        "tag": 2,
        "type": "kokoro.common.v1.CommandIdentity"
      },
      "rootMembers": [
        "command_digest_version",
        "fq_method",
        "tenant_ref",
        "command"
      ],
      "commandMembers": [
        "connector_id:id<McpConnectorId>",
        "authorization_id:id<McpAuthorizationId>",
        "authorization_handle_ref:string"
      ],
      "excludedMembers": ["request_id", "command", "execution_proof"]
    },
    {
      "operation": "mcp.revoke_connector",
      "fqMethod": "kokoro.platform.v1.McpConnectorService/RevokeMcpConnector",
      "commandField": {
        "field": "command",
        "tag": 2,
        "type": "kokoro.common.v1.CommandIdentity"
      },
      "rootMembers": [
        "command_digest_version",
        "fq_method",
        "tenant_ref",
        "command"
      ],
      "commandMembers": ["connector_id:id<McpConnectorId>", "reason:string"],
      "excludedMembers": ["request_id", "command", "execution_proof"]
    },
    {
      "operation": "mcp.create_connection",
      "fqMethod": "kokoro.platform.v1.McpConnectionService/CreateMcpConnection",
      "commandField": {
        "field": "command",
        "tag": 2,
        "type": "kokoro.common.v1.CommandIdentity"
      },
      "rootMembers": [
        "command_digest_version",
        "fq_method",
        "tenant_ref",
        "command"
      ],
      "commandMembers": [
        "connector_id:id<McpConnectorId>",
        "server_id:id<McpServerId>",
        "allowed_selectors:set<string>"
      ],
      "excludedMembers": ["request_id", "command", "execution_proof"]
    },
    {
      "operation": "mcp.revoke_connection",
      "fqMethod": "kokoro.platform.v1.McpConnectionService/RevokeMcpConnection",
      "commandField": {
        "field": "command",
        "tag": 2,
        "type": "kokoro.common.v1.CommandIdentity"
      },
      "rootMembers": [
        "command_digest_version",
        "fq_method",
        "tenant_ref",
        "command"
      ],
      "commandMembers": ["connection_id:id<McpConnectionId>", "reason:string"],
      "excludedMembers": ["request_id", "command", "execution_proof"]
    }
  ],
  "authorizeMcpToolIdempotency": "idempotency_key",
  "globalCommandIdentity": "forbidden"
}
